license,name,tipo,categoria,rk_1,rk_2,nacionalidad,season,genre,category,team_id
18404,DIONISIO DOMINGO ARANGUREN PEREZ,A.2,V70-M, 221.0 , 256.0 ,ESPAÑOLA,2023-2024,male,segona-nacional,2017357
19979,FRANCISCO JOSE GIL  CANO,A.2,SEN-M, 228.0 , 228.0 ,ESPAÑOLA,2023-2024,male,segona-nacional,2017357
1521,FRANCISCO JOSE IBAÑEZ CARRILLO,A.2,V50-M, 364.0 , 403.0 ,ESPAÑOLA,2023-2024,male,segona-nacional,2017357
5060,JOSE ANTONIO GALLEGO GARCIA,A.2,SEN-M, 383.0 , 388.0 ,ESPAÑOLA,2023-2024,male,segona-nacional,2017357
943,JOSE ANTONIO TEJUELO GARCIA,A.2,V50-M, -2.0 , -2.0 ,ESPAÑOLA,2023-2024,male,segona-nacional,2017357
409,JOSE MARIA SALVADOR DE ESPAÑA MOYA,A.2,V65-M, 30.0 , 30.0 ,ESPAÑOLA,2023-2024,male,segona-nacional,2017357
1792,PEDRO JOSE GONZALEZ ROBLES,A.2,V40-M, 30.0 , 30.0 ,ESPAÑOLA,2023-2024,male,segona-nacional,2017357
20727,VALENTÍN ROMERO BAUTISTA,A.2,V65-M, -45.0 , -45.0 ,ESPAÑOLA,2023-2024,male,segona-nacional,2017357
